{
  "schema_version": "0.1.0",
  "id": "u-blox/ublox-max-m10s",
  "legacy_ids": [
    "ublox-max-m10s"
  ],
  "name": "u-blox MAX-M10S GNSS 模组",
  "manufacturer_id": "u-blox",
  "manufacturer_role": "product_manufacturer",
  "mpn": null,
  "hardware_revision": null,
  "category": "sensor",
  "product_type": "module",
  "capabilities": [
    "gnss",
    "position",
    "velocity",
    "time_sync"
  ],
  "interfaces": [
    "UART",
    "I2C",
    "GPIO"
  ],
  "specifications": {
    "supply_voltage": {
      "min": 1.76,
      "typ": 3.3,
      "max": 3.6,
      "unit": "V",
      "basis": "legacy_unspecified",
      "port": null
    }
  },
  "sources": [
    {
      "id": "primary",
      "title": "MAX-M10 Series Product Page",
      "authority": "official",
      "url": "https://www.u-blox.com/en/product/max-m10-series"
    }
  ],
  "evidence": [
    {
      "field": "/specifications/supply_voltage",
      "source_id": "primary",
      "binding": "inherited_unreviewed",
      "locator": null
    }
  ],
  "relations": [],
  "validation": {
    "status": "needs_review",
    "reviews": [],
    "tests": []
  },
  "unresolved": [
    "迁移资料尚未逐字段核对来源及章节",
    "精确订货号及硬件版本待核对",
    "供电端口、工作范围与极限值语义待核对",
    "接口与可用引脚资源待核对",
    "旧库标注需要载板集成复核"
  ],
  "provenance": {
    "origin": "ForgeAI local knowledge migration",
    "origin_id": "ublox-max-m10s",
    "source_files": [
      "data/electronics_kb/entries/ublox-max-m10s.md"
    ],
    "source_hashes": {
      "data/electronics_kb/entries/ublox-max-m10s.md": "624e0f94e01a731a2f02f6c119bbece3f19855d6c9b27924d0ec24806296fc2b"
    },
    "license": "BSD-3-Clause",
    "copyright": "2026 landuochong"
  },
  "legacy": {
    "id": "ublox-max-m10s",
    "name": "u-blox MAX-M10S GNSS 模组",
    "manufacturer": "u-blox",
    "category": "sensor",
    "kind": "gnss_receiver_module",
    "capabilities": [
      "gnss",
      "position",
      "velocity",
      "time_sync"
    ],
    "interfaces": [
      "UART",
      "I2C",
      "GPIO"
    ],
    "supply_v": {
      "min": 1.76,
      "typ": 3.3,
      "max": 3.6
    },
    "lifecycle": "active",
    "confidence": 0.96,
    "verification": "source_verified",
    "integration_review_required": true,
    "source": {
      "title": "MAX-M10 Series Product Page",
      "authority": "official",
      "url": "https://www.u-blox.com/en/product/max-m10-series"
    }
  }
}
