{
  "schema_version": "0.1.0",
  "id": "espressif/esp32-c6-wroom-1",
  "legacy_ids": [
    "esp32-c6-wroom-1"
  ],
  "name": "ESP32-C6-WROOM-1 模组",
  "manufacturer_id": "espressif",
  "manufacturer_role": "product_manufacturer",
  "mpn": null,
  "hardware_revision": null,
  "category": "wireless_module",
  "product_type": "module",
  "capabilities": [
    "wifi",
    "ble",
    "zigbee",
    "thread",
    "i2c",
    "spi",
    "uart",
    "usb",
    "adc"
  ],
  "interfaces": [
    "I2C",
    "SPI",
    "UART",
    "USB",
    "GPIO",
    "ADC"
  ],
  "specifications": {
    "supply_voltage": {
      "min": 3.0,
      "typ": 3.3,
      "max": 3.6,
      "unit": "V",
      "basis": "legacy_unspecified",
      "port": null
    }
  },
  "sources": [
    {
      "id": "primary",
      "title": "ESP32-C6-WROOM-1 Datasheet",
      "authority": "official",
      "url": "https://www.espressif.com/sites/default/files/documentation/esp32-c6-wroom-1_datasheet_en.pdf"
    }
  ],
  "evidence": [
    {
      "field": "/specifications/supply_voltage",
      "source_id": "primary",
      "binding": "inherited_unreviewed",
      "locator": null
    }
  ],
  "relations": [],
  "validation": {
    "status": "needs_review",
    "reviews": [],
    "tests": []
  },
  "unresolved": [
    "迁移资料尚未逐字段核对来源及章节",
    "精确订货号及硬件版本待核对",
    "供电端口、工作范围与极限值语义待核对",
    "接口与可用引脚资源待核对",
    "旧库标注需要载板集成复核"
  ],
  "provenance": {
    "origin": "ForgeAI local knowledge migration",
    "origin_id": "esp32-c6-wroom-1",
    "source_files": [
      "data/electronics_kb/entries/esp32-c6-wroom-1.md"
    ],
    "source_hashes": {
      "data/electronics_kb/entries/esp32-c6-wroom-1.md": "c629412037ed4e12924464723d4824a6fc90dab9939ae62790aa334c84fe5573"
    },
    "license": "BSD-3-Clause",
    "copyright": "2026 landuochong"
  },
  "legacy": {
    "id": "esp32-c6-wroom-1",
    "name": "ESP32-C6-WROOM-1 模组",
    "manufacturer": "Espressif",
    "category": "wireless_module",
    "kind": "certified_wireless_module",
    "family": "ESP32-C6",
    "capabilities": [
      "wifi",
      "ble",
      "zigbee",
      "thread",
      "i2c",
      "spi",
      "uart",
      "usb",
      "adc"
    ],
    "interfaces": [
      "I2C",
      "SPI",
      "UART",
      "USB",
      "GPIO",
      "ADC"
    ],
    "supply_v": {
      "min": 3.0,
      "typ": 3.3,
      "max": 3.6
    },
    "lifecycle": "active",
    "confidence": 0.95,
    "verification": "source_verified",
    "integration_review_required": true,
    "source": {
      "title": "ESP32-C6-WROOM-1 Datasheet",
      "authority": "official",
      "url": "https://www.espressif.com/sites/default/files/documentation/esp32-c6-wroom-1_datasheet_en.pdf"
    }
  }
}
