{
  "schema_version": "0.1.0",
  "id": "dfrobot/dfrobot-sen0193",
  "legacy_ids": [
    "dfrobot-sen0193"
  ],
  "name": "DFRobot SEN0193 电容式土壤湿度传感器",
  "manufacturer_id": "dfrobot",
  "manufacturer_role": "product_manufacturer",
  "mpn": null,
  "hardware_revision": null,
  "category": "sensor",
  "product_type": "module",
  "capabilities": [
    "soil_moisture"
  ],
  "interfaces": [
    "ADC"
  ],
  "specifications": {
    "supply_voltage": {
      "min": 3.3,
      "typ": 3.3,
      "max": 5.5,
      "unit": "V",
      "basis": "legacy_unspecified",
      "port": null
    },
    "planning_active_current_ma": {
      "value": 5,
      "unit": "mA",
      "basis": "planning_estimate",
      "conditions": null
    }
  },
  "sources": [
    {
      "id": "primary",
      "title": "Capacitive Soil Moisture Sensor SEN0193 Wiki",
      "authority": "official",
      "url": "https://wiki.dfrobot.com/sen0193"
    }
  ],
  "evidence": [
    {
      "field": "/specifications/supply_voltage",
      "source_id": "primary",
      "binding": "inherited_unreviewed",
      "locator": null
    },
    {
      "field": "/specifications/planning_active_current_ma",
      "source_id": "primary",
      "binding": "inherited_unreviewed",
      "locator": null
    }
  ],
  "relations": [],
  "validation": {
    "status": "needs_review",
    "reviews": [],
    "tests": []
  },
  "unresolved": [
    "迁移资料尚未逐字段核对来源及章节",
    "精确订货号及硬件版本待核对",
    "供电端口、工作范围与极限值语义待核对",
    "接口与可用引脚资源待核对",
    "历史价格无采集时间，仅保留快照，不作为采购报价"
  ],
  "provenance": {
    "origin": "ForgeAI local knowledge migration",
    "origin_id": "dfrobot-sen0193",
    "source_files": [
      "data/electronics_kb/entries/dfrobot-sen0193.md"
    ],
    "source_hashes": {
      "data/electronics_kb/entries/dfrobot-sen0193.md": "689cec8b0170686a58a0277f31ede6e441dff6323866d3acb67e737464b28a77"
    },
    "license": "BSD-3-Clause",
    "copyright": "2026 landuochong"
  },
  "legacy": {
    "id": "dfrobot-sen0193",
    "name": "DFRobot SEN0193 电容式土壤湿度传感器",
    "manufacturer": "DFRobot",
    "category": "sensor",
    "kind": "sensor_module",
    "capabilities": [
      "soil_moisture"
    ],
    "interfaces": [
      "ADC"
    ],
    "supply_v": {
      "min": 3.3,
      "typ": 3.3,
      "max": 5.5
    },
    "planning_active_current_ma": 5,
    "unit_price_cny": 35,
    "lifecycle": "active",
    "confidence": 0.94,
    "verification": "source_verified",
    "calibration_required": true,
    "source": {
      "title": "Capacitive Soil Moisture Sensor SEN0193 Wiki",
      "authority": "official",
      "url": "https://wiki.dfrobot.com/sen0193"
    }
  }
}
