{
  "schema_version": "0.1.0",
  "id": "stmicroelectronics/nucleo-f446re",
  "legacy_ids": [
    "nucleo-f446re"
  ],
  "name": "NUCLEO-F446RE",
  "manufacturer_id": "stmicroelectronics",
  "manufacturer_role": "product_manufacturer",
  "mpn": null,
  "hardware_revision": null,
  "category": "controller_board",
  "product_type": "board",
  "capabilities": [
    "i2c",
    "spi",
    "uart",
    "adc",
    "can",
    "usb"
  ],
  "interfaces": [
    "I2C",
    "SPI",
    "UART",
    "USB",
    "GPIO"
  ],
  "specifications": {
    "supply_voltage": {
      "typ": 5.0,
      "unit": "V",
      "basis": "legacy_unspecified",
      "port": null
    },
    "planning_active_current_ma": {
      "value": 70,
      "unit": "mA",
      "basis": "planning_estimate",
      "conditions": null
    },
    "measured_board_sleep_current_ua": {
      "value": null,
      "unit": "uA",
      "basis": "measured",
      "conditions": null
    }
  },
  "sources": [
    {
      "id": "primary",
      "title": "NUCLEO-F446RE product page",
      "authority": "official",
      "url": "https://www.st.com/en/evaluation-tools/nucleo-f446re.html"
    },
    {
      "id": "pinout",
      "title": "UM1724 STM32 Nucleo-64 Boards MB1136 User Manual Rev 17",
      "url": "https://www.st.com/resource/en/user_manual/dm00105823-stm32-nucleo64-boards-mb1136-stmicroelectronics.pdf",
      "authority": "official",
      "section": "Table 19 ARDUINO connectors on NUCLEO-F446RE"
    }
  ],
  "evidence": [
    {
      "field": "/specifications/supply_voltage",
      "source_id": "primary",
      "binding": "inherited_unreviewed",
      "locator": null
    },
    {
      "field": "/specifications/planning_active_current_ma",
      "source_id": "primary",
      "binding": "inherited_unreviewed",
      "locator": null
    },
    {
      "field": "/specifications/measured_board_sleep_current_ua",
      "source_id": "primary",
      "binding": "inherited_unreviewed",
      "locator": null
    }
  ],
  "relations": [],
  "validation": {
    "status": "needs_review",
    "reviews": [],
    "tests": []
  },
  "unresolved": [
    "迁移资料尚未逐字段核对来源及章节",
    "精确订货号及硬件版本待核对",
    "供电端口、工作范围与极限值语义待核对",
    "接口与可用引脚资源待核对",
    "引脚为历史部分 GPIO 摘录，不是完整引脚表"
  ],
  "provenance": {
    "origin": "ForgeAI local knowledge migration",
    "origin_id": "nucleo-f446re",
    "source_files": [
      "data/components.json",
      "data/electronics_kb/entries/nucleo-f446re.md",
      "data/board_pins.json",
      "data/sources.json"
    ],
    "source_hashes": {
      "data/components.json": "f14b1e92f7728e387460ac041b5f8993e651add757586ba262647fefe5cce605",
      "data/electronics_kb/entries/nucleo-f446re.md": "0dbb7bba8af963cf4d687ec4fb45b4349703dc8a064531942d647a4d5a43fe02",
      "data/board_pins.json": "b350ae52324c5fc1b90d594c3f8e11050bf98b1353f7e47fa80095899cc5e7ce",
      "data/sources.json": "0756624935509bd5e0b394e67578a09cadd654e57f8069616debb3c9312ceccf"
    },
    "license": "BSD-3-Clause",
    "copyright": "2026 landuochong"
  },
  "legacy": {
    "id": "nucleo-f446re",
    "name": "NUCLEO-F446RE",
    "manufacturer": "STMicroelectronics",
    "category": "controller_board",
    "kind": "development_board",
    "family": "STM32F4",
    "capabilities": [
      "i2c",
      "spi",
      "uart",
      "adc",
      "can",
      "usb"
    ],
    "interfaces": [
      "I2C",
      "SPI",
      "UART",
      "USB",
      "GPIO"
    ],
    "supply_v": {
      "typ": 5.0
    },
    "planning_active_current_ma": 70,
    "measured_board_sleep_current_ua": null,
    "lifecycle": "active",
    "confidence": 0.95,
    "verification": "source_verified",
    "source": {
      "title": "NUCLEO-F446RE product page",
      "authority": "official",
      "url": "https://www.st.com/en/evaluation-tools/nucleo-f446re.html"
    }
  }
}
