{
  "schema_version": "0.1.0",
  "id": "stmicroelectronics/nucleo-l476rg",
  "legacy_ids": [
    "nucleo-l476rg"
  ],
  "name": "NUCLEO-L476RG",
  "manufacturer_id": "stmicroelectronics",
  "manufacturer_role": "product_manufacturer",
  "mpn": null,
  "hardware_revision": null,
  "category": "controller_board",
  "product_type": "board",
  "capabilities": [
    "low_power",
    "i2c",
    "spi",
    "uart",
    "adc",
    "can",
    "usb"
  ],
  "interfaces": [
    "I2C",
    "SPI",
    "UART",
    "CAN",
    "USB",
    "GPIO",
    "ADC",
    "PWM"
  ],
  "specifications": {
    "supply_voltage": {
      "typ": 5.0,
      "unit": "V",
      "basis": "legacy_unspecified",
      "port": null
    },
    "planning_active_current_ma": {
      "value": 60,
      "unit": "mA",
      "basis": "planning_estimate",
      "conditions": null
    },
    "measured_board_sleep_current_ua": {
      "value": null,
      "unit": "uA",
      "basis": "measured",
      "conditions": null
    }
  },
  "sources": [
    {
      "id": "primary",
      "title": "NUCLEO-L476RG Product Page",
      "authority": "official",
      "url": "https://www.st.com/en/evaluation-tools/nucleo-l476rg.html"
    }
  ],
  "evidence": [
    {
      "field": "/specifications/supply_voltage",
      "source_id": "primary",
      "binding": "inherited_unreviewed",
      "locator": null
    },
    {
      "field": "/specifications/planning_active_current_ma",
      "source_id": "primary",
      "binding": "inherited_unreviewed",
      "locator": null
    },
    {
      "field": "/specifications/measured_board_sleep_current_ua",
      "source_id": "primary",
      "binding": "inherited_unreviewed",
      "locator": null
    }
  ],
  "relations": [],
  "validation": {
    "status": "needs_review",
    "reviews": [],
    "tests": []
  },
  "unresolved": [
    "迁移资料尚未逐字段核对来源及章节",
    "精确订货号及硬件版本待核对",
    "供电端口、工作范围与极限值语义待核对",
    "接口与可用引脚资源待核对"
  ],
  "provenance": {
    "origin": "ForgeAI local knowledge migration",
    "origin_id": "nucleo-l476rg",
    "source_files": [
      "data/electronics_kb/entries/nucleo-l476rg.md"
    ],
    "source_hashes": {
      "data/electronics_kb/entries/nucleo-l476rg.md": "2d169cf2240be9971a25e5d7084e564ae8842cb9c20a14aa9e2485d151a2117e"
    },
    "license": "BSD-3-Clause",
    "copyright": "2026 landuochong"
  },
  "legacy": {
    "id": "nucleo-l476rg",
    "name": "NUCLEO-L476RG",
    "manufacturer": "STMicroelectronics",
    "category": "controller_board",
    "kind": "development_board",
    "family": "STM32L4",
    "capabilities": [
      "low_power",
      "i2c",
      "spi",
      "uart",
      "adc",
      "can",
      "usb"
    ],
    "interfaces": [
      "I2C",
      "SPI",
      "UART",
      "CAN",
      "USB",
      "GPIO",
      "ADC",
      "PWM"
    ],
    "supply_v": {
      "typ": 5.0
    },
    "planning_active_current_ma": 60,
    "measured_board_sleep_current_ua": null,
    "lifecycle": "active",
    "confidence": 0.97,
    "verification": "source_verified",
    "source": {
      "title": "NUCLEO-L476RG Product Page",
      "authority": "official",
      "url": "https://www.st.com/en/evaluation-tools/nucleo-l476rg.html"
    }
  }
}
